{
  "schema": "ocs-case/1",
  "id": "L06.alias.with-take-unselected",
  "title": "an aliased take hides unselected declarations",
  "purpose": "Observe module resolution and visibility.",
  "level": "L06",
  "contracts": [
    {
      "contract": "MOD.ALIAS",
      "aspects": [
        "invalid"
      ]
    }
  ],
  "mode": "run",
  "sources": [
    "main.ok"
  ],
  "entry": "main.ok",
  "support": [
    "lib/shapes.ok"
  ],
  "requires": {
    "environment": [
      "stdout"
    ]
  },
  "expect": {
    "outcome": "error",
    "failure": {
      "stages": [
        "check",
        "runtime"
      ],
      "categories": [
        "semantic",
        "runtime"
      ],
      "justification": "The rule is stated without a detection stage; static analysis, import loading or execution may report it. The program must not complete."
    },
    "stdout": {
      "text": ""
    }
  },
  "spec_refs": [
    "docs/okkama-spec-11072026.md#5.2"
  ],
  "budget": {
    "timeout_s": 30
  },
  "provenance": {
    "origin": "authored for OCS 0.1.0 from the cited contract text",
    "expected_basis": "spec 5.2: when combined with take, the alias namespace contains only the selected directly owned declarations."
  },
  "status": "mandatory"
}
