{
  "schema": "ocs-case/1",
  "id": "L01.gram.enum.decl",
  "title": "enum declarations and case access",
  "purpose": "Accept the construct and observe its result.",
  "level": "L01",
  "contracts": [
    {
      "contract": "GRAM.ENUM-DECL",
      "aspects": [
        "normal"
      ]
    },
    {
      "contract": "ENUM.VALUES",
      "aspects": [
        "normal"
      ]
    }
  ],
  "mode": "run",
  "sources": [
    "main.ok"
  ],
  "entry": "main.ok",
  "requires": {
    "environment": [
      "stdout"
    ]
  },
  "expect": {
    "outcome": "success",
    "exit_status": 0,
    "stdout": {
      "text": "failed\none\n"
    }
  },
  "spec_refs": [
    "docs/okkama-grammar-1.0.ebnf",
    "docs/okkama-spec-11072026.md#15"
  ],
  "budget": {
    "timeout_s": 30
  },
  "provenance": {
    "origin": "authored for OCS 0.1.0 from the cited contract text",
    "expected_basis": "spec 15: `enum Name = (cases);`, cases referenced as Enum.case and compared by type and case."
  },
  "status": "mandatory"
}
