{
  "schema": "ocs-case/1",
  "id": "L04.roles.named-args-use-role-names",
  "title": "named arguments use the role's parameter names",
  "purpose": "Observe object, role, cap and successor semantics.",
  "level": "L04",
  "contracts": [
    {
      "contract": "ROLE.RESTRICTED-REFERENCE",
      "aspects": [
        "boundary"
      ]
    }
  ],
  "mode": "run",
  "sources": [
    "main.ok"
  ],
  "entry": "main.ok",
  "requires": {
    "environment": [
      "stdout"
    ]
  },
  "expect": {
    "outcome": "success",
    "exit_status": 0,
    "stdout": {
      "text": "Hello, Ada\n"
    }
  },
  "spec_refs": [
    "docs/okkama-spec-11072026.md#12.1"
  ],
  "budget": {
    "timeout_s": 30
  },
  "provenance": {
    "origin": "authored for OCS 0.1.0 from the cited contract text",
    "expected_basis": "spec 12.1: named arguments use the role's parameter names, independently of implementation names."
  },
  "status": "mandatory"
}
