{
  "schema": "ocs-case/1",
  "id": "L04.caps.duplicate-field",
  "title": "cap declaration rejected: computed field names are unique",
  "purpose": "The construct is invalid and must not complete.",
  "level": "L04",
  "contracts": [
    {
      "contract": "CAP.DECL",
      "aspects": [
        "invalid"
      ]
    }
  ],
  "mode": "run",
  "sources": [
    "main.ok"
  ],
  "entry": "main.ok",
  "requires": {
    "environment": [
      "stdout"
    ]
  },
  "expect": {
    "outcome": "error",
    "failure": {
      "stages": [
        "parse",
        "check",
        "runtime"
      ],
      "categories": [
        "syntax",
        "semantic",
        "runtime"
      ],
      "justification": "A declaration-level rule: the grammar lists it as a context-sensitive restriction checked after parsing, and an implementation may also detect it at registration/runtime. The program must not complete."
    },
    "stdout": {
      "text": ""
    }
  },
  "spec_refs": [
    "docs/okkama-spec-11072026.md#11.2.1",
    "docs/object-caps-0.0.1-ru.md"
  ],
  "budget": {
    "timeout_s": 30
  },
  "provenance": {
    "origin": "authored for OCS 0.1.0 from the cited contract text",
    "expected_basis": "caps guide: computed field names are unique."
  },
  "status": "mandatory"
}
