{
  "schema": "ocs-case/1",
  "id": "L02.rat.constructor",
  "title": "rat(n, d) normalises and exposes exact parts",
  "purpose": "Observe the values produced by the operation.",
  "level": "L02",
  "contracts": [
    {
      "contract": "VAL.RAT",
      "aspects": [
        "normal"
      ]
    },
    {
      "contract": "VAL.CAST-METHODS",
      "aspects": [
        "normal"
      ]
    }
  ],
  "mode": "run",
  "sources": [
    "main.ok"
  ],
  "entry": "main.ok",
  "requires": {
    "environment": [
      "stdout"
    ]
  },
  "expect": {
    "outcome": "success",
    "exit_status": 0,
    "stdout": {
      "text": "1/2\n1/2\n-1/2\n0\n3/2\nequal\n"
    }
  },
  "spec_refs": [
    "docs/okkama-spec-11072026.md#8.3",
    "docs/okkama-spec-11072026.md#6.6"
  ],
  "budget": {
    "timeout_s": 30
  },
  "provenance": {
    "origin": "authored for OCS 0.1.0 from the cited contract text",
    "expected_basis": "spec 8.3: rat normalises by gcd with positive denominator; numerator()/denominator() return exact decimal strings."
  },
  "status": "mandatory"
}
