{
  "schema": "ocs-case/1",
  "id": "L01.lex.float.trailing-dot",
  "title": "`1.` is not a float literal",
  "purpose": "Malformed source is rejected by the lexer/parser.",
  "level": "L01",
  "contracts": [
    {
      "contract": "LEX.FLOAT-LITERALS",
      "aspects": [
        "invalid"
      ]
    }
  ],
  "mode": "parse",
  "sources": [
    "main.ok"
  ],
  "entry": "main.ok",
  "expect": {
    "outcome": "reject",
    "rejection": {
      "stages": [
        "parse"
      ],
      "categories": [
        "syntax"
      ]
    }
  },
  "spec_refs": [
    "docs/okkama-grammar-1.0.ebnf"
  ],
  "budget": {
    "timeout_s": 30
  },
  "provenance": {
    "origin": "authored for OCS 0.1.0 from the cited contract text",
    "expected_basis": "grammar FLOAT = [0-9]+ . [0-9]+; `1.` leaves a dot with no member name."
  },
  "status": "mandatory"
}
