{
  "schema": "ocs-case/1",
  "id": "L05.array.no-push",
  "title": "arrays have no mutating builtins",
  "purpose": "The construct is invalid and must not complete.",
  "level": "L05",
  "contracts": [
    {
      "contract": "COLL.ARRAY",
      "aspects": [
        "interaction"
      ]
    }
  ],
  "mode": "run",
  "sources": [
    "main.ok"
  ],
  "entry": "main.ok",
  "requires": {
    "environment": [
      "stdout"
    ]
  },
  "expect": {
    "outcome": "error",
    "failure": {
      "stages": [
        "check",
        "runtime"
      ],
      "categories": [
        "semantic",
        "runtime"
      ],
      "justification": "The contract makes this an error without fixing the detection stage (spec 6.3: a static pass may diagnose boundary mismatches before execution). The program must not complete."
    },
    "stdout": {
      "text": ""
    }
  },
  "spec_refs": [
    "docs/okkama-llm-context-1.0.md#8"
  ],
  "budget": {
    "timeout_s": 30
  },
  "provenance": {
    "origin": "authored for OCS 0.1.0 from the cited contract text",
    "expected_basis": "LLM context 8: arrays are immutable; there is no push/append/set builtin."
  },
  "status": "mandatory"
}
