{
  "schema": "ocs-case/1",
  "id": "L05.generic.identity-in-collections",
  "title": "applied generic types are identities inside collections",
  "purpose": "Observe type, generic and collection semantics.",
  "level": "L05",
  "contracts": [
    {
      "contract": "GEN.IDENTITY",
      "aspects": [
        "normal",
        "interaction"
      ]
    }
  ],
  "mode": "run",
  "sources": [
    "main.ok"
  ],
  "entry": "main.ok",
  "requires": {
    "environment": [
      "stdout"
    ]
  },
  "expect": {
    "outcome": "success",
    "exit_status": 0,
    "stdout": {
      "text": "3\n"
    }
  },
  "spec_refs": [
    "docs/okkama-spec-11072026.md#6.5"
  ],
  "budget": {
    "timeout_s": 30
  },
  "provenance": {
    "origin": "authored for OCS 0.1.0 from the cited contract text",
    "expected_basis": "spec 6.5: typed arrays of applied generics validate each specialization."
  },
  "status": "mandatory"
}
