{
  "schema": "ocs-case/1",
  "id": "L03.recursion.self-and-mutual",
  "title": "direct and mutual recursion",
  "purpose": "Observe control flow and call semantics.",
  "level": "L03",
  "contracts": [
    {
      "contract": "CTRL.RECURSION",
      "aspects": [
        "normal"
      ]
    }
  ],
  "mode": "run",
  "sources": [
    "main.ok"
  ],
  "entry": "main.ok",
  "requires": {
    "environment": [
      "stdout"
    ]
  },
  "expect": {
    "outcome": "success",
    "exit_status": 0,
    "stdout": {
      "text": "3628800\n610\neven\n"
    }
  },
  "spec_refs": [
    "docs/okkama-spec-11072026.md#11.6"
  ],
  "budget": {
    "timeout_s": 30
  },
  "provenance": {
    "origin": "authored for OCS 0.1.0 from the cited contract text",
    "expected_basis": "10! = 3628800; fib(15) = 610 with fib(0)=0, fib(1)=1; even/odd mutual recursion."
  },
  "status": "mandatory"
}
