{
  "schema": "ocs-case/1",
  "id": "L08.void.await-for-effect",
  "title": "async void completions are awaited for effect",
  "purpose": "Observe asynchronous behaviour through causal events.",
  "level": "L08",
  "contracts": [
    {
      "contract": "ASYNC.VOID",
      "aspects": [
        "normal"
      ]
    }
  ],
  "mode": "run",
  "sources": [
    "main.ok"
  ],
  "entry": "main.ok",
  "requires": {
    "environment": [
      "stdout"
    ]
  },
  "expect": {
    "outcome": "success",
    "exit_status": 0,
    "stdout": {
      "text": "first\nsecond\n"
    }
  },
  "spec_refs": [
    "docs/okkama-spec-11072026.md#11.6",
    "docs/okkama-spec-11072026.md#18"
  ],
  "budget": {
    "timeout_s": 30
  },
  "provenance": {
    "origin": "authored for OCS 0.1.0 from the cited contract text",
    "expected_basis": "spec 11.6: `await command.commit();` waits without producing a value; a void completion handle may be awaited more than once and runs once."
  },
  "status": "mandatory"
}
